{
  "name": "platform-bulk-data-processing",
  "version": "0.1.0",
  "domain": "platform",
  "capability": "bulk-data-processing",
  "description": "Bulk API 2.0, batch Apex, DataLoader, governor limits, heap size, CPU timeout, async processing",
  "api-version-min": "60.0",
  "salesforce-release-min": "Winter25",
  "approval-tier": "draft",
  "compliance": {
    "org-types": [
      "scratch",
      "sandbox"
    ],
    "data-sensitivity": "none"
  },
  "requires-features": [],
  "boundary": [],
  "maintainers": [
    "mdevaraju-architect"
  ]
}