{
  "name": "sales-forecasting",
  "version": "0.1.0",
  "domain": "sales",
  "capability": "forecasting",
  "description": "collaborative forecasting, ForecastingItem, territory, overlay, quota, ForecastingQuota, forecast hierarchy",
  "api-version-min": "60.0",
  "salesforce-release-min": "Winter25",
  "approval-tier": "draft",
  "compliance": {
    "org-types": [
      "scratch",
      "sandbox"
    ],
    "data-sensitivity": "none"
  },
  "requires-features": [],
  "boundary": [],
  "maintainers": [
    "skillforge-maintainers"
  ]
}