{
  "name": "industries-fsc-mortgage-origination",
  "version": "0.1.0",
  "domain": "industries/fsc",
  "capability": "mortgage-origination",
  "description": "LoanApplicationLead, loan application, underwriting, closing, mortgage, LoanApplicant, origination, servicing",
  "api-version-min": "60.0",
  "salesforce-release-min": "Winter25",
  "approval-tier": "draft",
  "compliance": {
    "org-types": [
      "scratch",
      "sandbox"
    ],
    "data-sensitivity": "none"
  },
  "requires-features": [],
  "boundary": [],
  "maintainers": [
    "mdevaraju-architect"
  ]
}