{
  "name": "industries-health-cloud-provider-management",
  "version": "0.1.0",
  "domain": "industries/health-cloud",
  "capability": "provider-management",
  "description": "HealthcareProvider, credentialing, network, referral, provider management, care network, health cloud",
  "api-version-min": "60.0",
  "salesforce-release-min": "Winter25",
  "approval-tier": "draft",
  "compliance": {
    "org-types": [
      "scratch",
      "sandbox"
    ],
    "data-sensitivity": "none"
  },
  "requires-features": [],
  "boundary": [],
  "maintainers": [
    "skillforge-maintainers"
  ]
}