{
  "name": "data-cloud-ingestion-and-streaming",
  "version": "0.1.0",
  "domain": "data-cloud",
  "capability": "ingestion-and-streaming",
  "description": "Data Cloud, ingestion, streaming API, connector, batch ingestion, Data Stream, Data Lake Object, DLO, transform",
  "api-version-min": "60.0",
  "salesforce-release-min": "Winter25",
  "approval-tier": "draft",
  "compliance": {
    "org-types": [
      "scratch",
      "sandbox"
    ],
    "data-sensitivity": "none"
  },
  "requires-features": [],
  "boundary": [],
  "maintainers": [
    "skillforge-maintainers"
  ]
}