{
  "name": "industries-net-zero-sustainability-reporting",
  "version": "0.1.0",
  "domain": "industries/net-zero",
  "capability": "sustainability-reporting",
  "description": "NetZero, EmissionsInventory, ESG, sustainability reporting, carbon footprint, audit trail, net zero cloud",
  "api-version-min": "60.0",
  "salesforce-release-min": "Winter25",
  "approval-tier": "draft",
  "compliance": {
    "org-types": [
      "scratch",
      "sandbox"
    ],
    "data-sensitivity": "none"
  },
  "requires-features": [],
  "boundary": [],
  "maintainers": [
    "skillforge-maintainers"
  ]
}