{
  "name": "platform-integration-patterns",
  "version": "1.0.0",
  "domain": "platform",
  "capability": "integration-patterns",
  "description": "Salesforce integration — REST/SOAP/Apex REST, outbound callouts, Platform Events, CDC, External Objects, Named Credentials, idempotency patterns",
  "api-version-min": "60.0",
  "salesforce-release-min": "Summer25",
  "approval-tier": "draft",
  "compliance": {
    "regulations": ["SOC2"],
    "org-types": ["scratch","sandbox","uat","production"],
    "data-sensitivity": "confidential"
  },
  "requires-features": [],
  "boundary": [
    "MuleSoft Anypoint platform configuration",
    "Streaming API UI subscriptions",
    "OAuth flow and connected app setup — use platform-security-and-sharing",
    "Bulk API for data migration — use platform-bulk-data-processing"
  ],
  "maintainers": ["skillforge-maintainers"]
}
