{
  "name": "service-case-lifecycle",
  "version": "1.0.0",
  "domain": "service",
  "capability": "case-lifecycle",
  "description": "Service Cloud case lifecycle — intake, routing, SLA with entitlements and milestones, escalation, channels (Web/Email/Chat), and closure",
  "api-version-min": "60.0",
  "salesforce-release-min": "Summer25",
  "approval-tier": "draft",
  "compliance": {
    "regulations": ["SOC2"],
    "org-types": ["scratch", "sandbox", "uat", "production"],
    "data-sensitivity": "confidential"
  },
  "requires-features": ["ServiceCloud"],
  "boundary": [
    "OmniChannel routing engine — use service-omni-channel-routing",
    "Knowledge Management — use service-knowledge-management",
    "Field Service — use service-field-service",
    "Chat and Messaging UI configuration"
  ],
  "maintainers": ["skillforge-maintainers"]
}
