{
  "name": "platform-async-patterns",
  "version": "1.0.0",
  "domain": "platform",
  "capability": "async-patterns",
  "description": "Salesforce async execution — @future, Queueable, Schedulable, Platform Events, CDC, Continuation, event replay, transaction finalizers",
  "api-version-min": "60.0",
  "salesforce-release-min": "Summer25",
  "approval-tier": "draft",
  "compliance": {
    "regulations": ["SOC2"],
    "org-types": ["scratch", "sandbox", "uat", "production"],
    "data-sensitivity": "confidential"
  },
  "requires-features": [],
  "boundary": [
    "Bulk data processing and Batch Apex — use platform-bulk-data-processing",
    "Apex REST callout configuration — use platform-integration-patterns",
    "Flow async actions (Autolaunched Flow)",
    "Pub/Sub API external CDC consumers"
  ],
  "maintainers": ["skillforge-maintainers"]
}
