{
  "name": "platform-security-and-sharing",
  "version": "0.1.0",
  "domain": "platform",
  "capability": "security-and-sharing",
  "description": "sharing model, OWD, role hierarchy, sharing rules, FLS field-level security, encryption, Shield, connected app, profile, permission set",
  "api-version-min": "60.0",
  "salesforce-release-min": "Winter25",
  "approval-tier": "draft",
  "compliance": {
    "org-types": [
      "scratch",
      "sandbox"
    ],
    "data-sensitivity": "none"
  },
  "requires-features": [],
  "boundary": [],
  "maintainers": [
    "mdevaraju-architect"
  ]
}