{
  "name": "sales-opportunity-to-close",
  "version": "1.0.0",
  "domain": "sales",
  "capability": "opportunity-to-close",
  "description": "Sales Cloud opportunity lifecycle — stage management, products, quotes, pipeline reporting, and CPQ handoff",
  "api-version-min": "60.0",
  "salesforce-release-min": "Summer25",
  "approval-tier": "draft",
  "compliance": {
    "regulations": ["SOC2"],
    "org-types": ["scratch", "sandbox", "uat", "production"],
    "data-sensitivity": "confidential"
  },
  "requires-features": ["SalesCloud"],
  "boundary": [
    "Revenue Cloud pricing engine — use sales-revenue-cloud",
    "Collaborative Forecasting — use sales-forecasting",
    "Territory Management — use sales-territory-management",
    "Service Cloud Cases — use service-case-lifecycle",
    "CPQ/SBQQ deep configuration"
  ],
  "maintainers": ["skillforge-maintainers"]
}
